query,keywords
"plagiarism, java projects,  changing names, rearranging structure, and modifying inconsequential fields",plagiarism;java projects;changing names;rearranging structure;modifying inconsequential fields
datasets of Java projects which display plagiarism,Java projects;plagiarism
books and features data,books;features
dataset about books and their features,books;features
a dataset that contains books and features of those books.,books;features;books
books and features of those books,books;features;books
dataset that has books and features of those books for recommendation model,books;features;books
books profile dataset,books profile
a dataset that has books and features of those books ,books;features;books
dataset that has books and features of those books.,books;features;books
books and features,books;features
datasets contains books and features of those books,books;features;books
"images of full human bodies, pref front and side shots no blocking",images;human bodies;front;side
open dataset of full human bodies,open;human bodies
"images of full human bodies(clothes on), prefer front and side shots with no objects blocking the human.",images;human bodies;front;side
" images of full human bodies,pref front and side shots,free",images;free;human bodies;front;side
"free dataset of images of full human bodies,front and side shots, no objects blocking the human, standing with heights ",free;images;human bodies;front;side
public human image dataset,public;image;human
"a free-access dataset of images of full human bodies, pref front and side shots with no objects blocking the human",free-access;images;human bodies;front;side
"free-access dataset of images of full human bodies, pref front and side shots with no objects blocking the human. ",free-access;images;human bodies;front;side
images £¬ full human bodies£¬ pref front and side shots£¬ no objects blocking,images;human bodies;front;side
free datasets of images of full human bodies,free;images;human bodies
nutrition facts for commercial food products,nutrition;commercial food products
nutrition data for commercial food products,nutrition;commercial food products
nutrition data for commercial food products ,nutrition;commercial food products
"Nutrition Facts,table on the majority of product packaging,nutrition data for many commercial food products",table;Nutrition;nutrition;commercial food products
"datasets with nutrition data for many commercial food products (i.e. Lucky Charms, Monster Energy, Nutella, etc)",Lucky Charms;Monster Energy;Nutella;nutrition;commercial food products
nutrition datasets with  commercial food products,nutrition;commercial food products
datasets with nutrition data for many commercial food products,nutrition;commercial food products
datasets with nutrition data for many commercial food products,nutrition;commercial food products
"commercial food products, nutrition, cereals or drinks",commercial food products;nutrition
datasets with nutrition data for many commercial food products,nutrition;commercial food products
"sample/anonymized dataset of businesses or consumers purchaser, items",businesses;consumers;purchaser;items
"businesses or consumers dataset about purchaser, items and what's purchased",businesses;consumers;purchaser;items;what's purchased
" businesses or consumers data that contain details on the purchaser, items , what's purchased, and if possible leads or opportunities.",businesses;consumers;purchaser;items;what's purchased
"purchaser, items , what's purchased",purchaser;items;what's purchased
"sample/anonymized dataset of businesses or consumers along with details on the purchaser, items , what's purchased, leads or opportunities",businesses;consumers;purchaser;items;what's purchased
anonymized businesses or consumers datasets,businesses;consumers
"dataset of businesses or consumers along with details on the purchaser, items which can be small",businesses;consumers;purchaser;items
" dataset of businesses or consumers along with details on the purchaser, items , what's purchased",businesses;consumers;purchaser;items;what's purchased
"businesses or consumers, purchaser, items , what's purchased, and if possible leads or opportunities",businesses;consumers;purchaser;items;what's purchased
sample datasets of buying information,buying
large sample files with multidimensional data,multidimensional
large data with multidimensional ,multidimensional
multidimensional categorical or quantitative data,multidimensional;categorical;quantitative
"multidimensional data,20 variables",20;multidimensional
"large sample files with multidimensional data, from spatio-temporal weather simulations to health studies,  with categorical and quantitative data",multidimensional;spatio-temporal weather simulations;health;categorical;quantitative
large scale multidimensional  datasets ,multidimensional
dataset about spatio-temporal weather simulations to health studies or preferably anything with 20 variables.,20;spatio-temporal weather simulations;health
categorical and mostly quantitative dataset,categorical;quantitative
"large, multidimensional, categorical and mostly quantitative, spatio-temporal weather simulations, health studies, 20 variables",20;multidimensional;categorical;quantitative;spatio-temporal weather simulations;health
spatio-temporal weather datasets,spatio-temporal weather
sample graph of web pages link,graph;web pages;link
web pages data with web graph about links between the pages,graph;web pages;links
"web graph of web pages, which represents the links between the web pages",graph;web pages;links;web pages
"web pages, and the web graph corresponding to them",graph;web pages
"dataset of web pages, and the web graph represents the links between the pages,  transition matrix, for  PageRank",graph;web pages;links
web pages datasets with its' corresponding web graph,graph;web pages
"a dataset of web pages, and the web graph corresponding to them",graph;web pages
"sample dataset of web pages, and the web graph corresponding to them",graph;web pages
"web graph, links between the pages",graph;links;pages
datasets of web pages and web graph,graph;web pages;web graph
"area code in the United States, and city/state",United States;area code;city;state
dataset including every area code in the United States and its major city/state,United States;area code;city;state
area codes of  the major city/state in the United States,United States;area codes;city;state
"area code , city/state in the United States",United States;area code;city;state
"dataset that includes every area code in the United States, and the major city/state matching each values",United States;area code;city;state
US area code dataset,US;area code
"a dataset that includes every area code in the United States, and the major city/state matching each values",United States;area code;city;state
"dataset that includes every area code in the United States, and the major city/state matching each values. ",United States;area code;city;state
"area code in the United States, major city/state matching each values",United States;area code;city;state
datasets contains matching of major cities and area codes,cities;area codes
translation datasets in different programming languages,translation;programming languages
translation programming languages datasets with pair of code in two languages,translation;programming languages;code
pairs of sentences in two different programming languages that mean the same thing,sentences;programming language
"translation datasets,pairs of sentences in two different natural languages that mean the same thing",translation;sentences;natural languages
"translation datasets include  pairs of programming language sentences in two different languages that mean the same thing, code",translation;programming language;sentences
translation datasets,translation
dataset similar to translation dataset where there are pairs of sentences in two different languages,translation;sentences;languages
 translation datasets where there are pairs of sentences in two different languages that mean the same thing,translation;sentences;languages
"pairs of sentences in two different languages that mean the same thing, programming languages, code",sentences;languages;programming languages
translation datasets in form of pairs of sentences,translation;sentences
nationally graduation rates by degree field 60s,60s;graduation rates;degree field
dataset on graduation rates by degree field,graduation rates;degree field
 graduation rates by degree field,graduation rates;degree field
"graduation rates,degree field,history",graduation rates;degree field
 data set on graduation rates by degree field for as far back as the 60s,60s;graduation rates;degree field
graduation rates datasets,graduation rates
a data set on graduation rates by degree field for as far back as the 60s if possible,60s;graduation rates;degree field
dataset on graduation rates by degree field for as far back as the 60s if possible.,60s;graduation rates;degree field
"nationally , state by state if possible, graduation rates by degree field, back to the 60s",60s;graduation rates;degree field
graduation rates datasets by degree field ,graduation rates;degree field
"human body size measurements shoulder width, arm length",human body;shoulder width;arm length
human body size measurements dataset,human body
human body size measurements dataset,human body
" human body size measurements,shoulder width, arm length, bust/chest circumference, waist circumference, hips, inseam, height",human body;shoulder width;arm length;bust/chest circumference;waist circumference;hips;inseam;height
"dataset has human body size measurements includes: shoulder width, arm length, bust/chest circumference, waist circumference, hips, inseam, height",human body;shoulder width;arm length;bust/chest circumference;waist circumference;hips;inseam;height
human body size measurements datasets,human body
a dataset that has human body size measurements as more as possible,human body
 dataset that has human body size measurements ,human body
"human body size measurements, shoulder width, arm length, bust/chest circumference, waist circumference, hips, inseam, height and neck size",human body;shoulder width;arm length;bust/chest circumference;waist circumference;hips;inseam;height;neck size
datasets contains human body size measurements,human body
median household income/wages 20 years US Japan,20 years;US;Japan;median household;income;wages
dataset about median household income/wages,median household;income;wages
"dataset on median household income/wages, preferably over the last 20 years and in US and Japan.",last 20 years;US;Japan;median household;income;wages
"median household income/wages in US and Japan,last 20 years",US;Japan;last 20 years;median household;income;wages
" dataset on median household income/wages, over the last 20 years, US and Japan",last 20 years;US;Japan;median household;income;wages
US and Japan median household income dataset  ,US;Japan;median household;income
a dataset on median household income/wages preferably over the last 20 years in US and Japan,last 20 years;US;Japan;median household;income;wages
dataset on median household income/wages,median household;income;wages
"median household income/wages, over the last 20 years, US and Japan",last 20 years;US;Japan;median household;income;wages
datasets on median household income/wages,median household;income;wages
rates of teachers leaving the profession by type,rates of teachers leaving the profession;type
dataset with teachers leving the profession,teachers leving the profession
rates of any type of teachers leaving the profession,type;rates of any type of teachers leaving the profession
"rates of teachers leaving the profession,type of teacher",rates of teachers leaving the profession;type
"dataset with rates of teachers leaving the profession, with type of teacher",rates of teachers leaving the profession;type
teachers leaving rate dataset,teachers leaving rate
"a dataset with rates of teachers leaving the profession,which be broken down by teachers' types would be better",rates of teachers leaving the profession;types
dataset with rates of teachers leaving the profession,rates of teachers leaving the profession
"rates of teachers leaving the profession, better if by type of teacher",rates of teachers leaving the profession;type
teachers leaving rates dataset,teachers leaving rates
IT projects labeled success or failure,IT projects;success;failure
dataset about mapped projects labeled with success or failure,projects;success;failure
"(IT) projects result(success or failure) and project metrics  such as budget, time, scope, etc.",(IT) projects;success;failure;budget;time;scope
"projects,budget, time, scope,labeled with success or failure",projects;budget;time;scope;success;failure
dataset that has mapped (preferably IT) projects and labeled them as a success or failure,(preferably IT) projects;success;failure
binarly labeled mapped (preferably IT) projects datasets,binarly labeled;(preferably IT) projects
a dataset that has mapped (preferably IT) projects and labeled them as a success or failure,(preferably IT) projects;success;failure
" predict whether a project will succeed or fail based on the project metrics such as budget, time, scope",project;succeed;fail;budget;time;scope
"mapped IT projects as a success or failure, budget, time, scope",IT projects;success;failure;budget;time;scope
IT projects datasets mapping with success or not,IT projects;success or not
public datasets containing inpatient disease/diagnosis history,public;inpatient disease/diagnosis history
inpatient disease/diagnosis history dataset,inpatient disease/diagnosis history
public datasets containing inpatient disease/diagnosis history,public;inpatient disease/diagnosis history
"public datasets,inpatient disease/diagnosis history",public;inpatient disease/diagnosis history
 public datasets containing inpatient disease/diagnosis history,public;inpatient disease/diagnosis history
 inpatient disease/diagnosis datasets,inpatient disease/diagnosis
public datasets containing inpatient disease/diagnosis history,public;inpatient disease/diagnosis history
 datasets containing inpatient disease/diagnosis history.,inpatient disease/diagnosis history
inpatient disease/diagnosis history,inpatient disease/diagnosis history
inpatient disease/diagnosis history public datasets,public;inpatient disease/diagnosis history
 images of parking lots taken from eye level,images;parking lots;eye level
images dataset about parking lot from eye level,images;parking lot;eye level
images of parking lots taken from eye level,images;parking lots;eye level
"images of parking lots from human,like google street view",images;parking lots from human
" dataset with images of parking lots taken from eye level, along the lines of google street view",images;parking lots;eye level
eye level parking lots images dataset,images;eye level;parking lots
 a dataset with images of parking lots taken from eye level about google street view ,images;parking lots;eye level
dataset with images of parking lots taken from eye level,images;parking lots;eye level
"images of parking lots taken from eye level, along the lines of google street view",images;parking lots;eye level
datasets contain images of parking taken from eye level,images;parking;eye level
jpg images for all unicode characters,jpg;unicode characters
jpg images dataset for all unicode characters,jpg;unicode characters
jpg images for all unicode characters,jpg;unicode characters
jpg images for all unicode characters,jpg;unicode characters
 jpg images for all unicode characters,jpg;unicode characters
 unicode characters jpg images dataset,jpg;unicode characters
dataset which contains jpg images for all unicode characters,jpg;unicode characters
jpg images for all unicode characters,jpg;unicode characters
"jpg images, unicode characters",jpg;unicode characters
images datasets of all unicode characters in jpg format,jpg;unicode characters
UK information on public opinion on different policy issues,UK;public opinion on different policy issues
dataset about public opinion on different policy issues,public opinion on different policy issues
"information on public opinion on different policy issues , preferably for the UK",UK;public opinion on different policy issues
"information on public opinion on different policy issues,UK,voting behaviour",UK;public opinion on different policy issues;voting behaviour
" datasets which contain information on public opinion on different policy issues, for the UK",UK;public opinion on different policy issues
UK public opinion on different policy issue datasets,UK;public opinion on different policy issue
datasets which contain information on public opinion on different policy issues (preferably for the UK),UK;public opinion on different policy issues
datasets which contain information on public opinion on different policy issues ,public opinion on different policy issues
"UK, public opinion on different policy issues, voting behaviour",UK;public opinion on different policy issues;voting behaviour
datasets which contain information on public opinion on different policy issues ,public opinion on different policy issues
latency in games IP logs,latency in games;IP;logs
dataset about latency in games,latency in games
 list of IP and their respective latency in games,IP;latency in games
"latency in games,IP",latency in games;IP
" dataset about latency in games, logs from matchmaker, with latency-ip relationship",latency in games;logs from matchmaker;latency-ip relationship
game latency dataset,game latency
dataset about latency in games,latency in games
 dataset about latency in games,latency in games
"latency in games, latency-ip relationship",latency in games;latency-ip relationship
dataset about latency in games,latency in games
football player tweets blogs new articles wikipedia,football player;tweets;blogs;new articles;wikipedia
dataset consists of infomation related to football players,football players
f tweets or blogs or new articles or wikipedia articles which are related to football players,tweets;blogs;new articles;wikipedia articles;football players
"text,football players,controversy ",text;football players;controversy
"textual dataset related to football players about controversy, tweets or blogs or new articles or wikipedia articles ",textual;football players;controversy;tweets;blogs;new articles;wikipedia articles
football players from tweets or blogs dataset,football players;tweets;blogs
dataset which consists of tweets or blogs or new articles or wikipedia articles which are related to football players ,tweets;blogs;new articles;wikipedia articles;football players
 dataset which consists of tweets or blogs or new articles or wikipedia articles ,tweets;blogs;new articles;wikipedia articles
"tweets or blogs or new articles or wikipedia articles related to football players, controversy ",tweets;blogs;new articles;wikipedia articles;football players;controversy
football players articles datasets from tweets or blogs,football players;articles;tweets;blogs
sales/inventory Power BI & SSRS SQL,sales/inventory;Power BI;SSRS;SQL
dataset about sales/inventory specific to learn/tryout Power BI & SSRS,sales/inventory;learn/tryout Power BI & SSRS
dataset connected with sales/inventory,sales/inventory
"sales/inventory,supported SQL Server",sales/inventory;SQL Server
"dataset connected with sales/inventory, for SQL Server database",sales/inventory;SQL Server database
dataset preferably connected with sales/inventory specific to learn/tryout Power BI & SSRS,sales/inventory;learn/tryout Power BI & SSRS
dataset preferably connected with sales/inventory specific to learn/tryout Power BI & SSRS,sales/inventory;learn/tryout Power BI & SSRS
"sales/inventory specific to learn/tryout Power BI & SSRS, SQL ","sales/inventory;learn/tryout Power BI & SSRS, SQL"
datasets connected with with sales/inventory specific to learn/tryout Power BI & SSRS,sales/inventory;learn/tryout Power BI & SSRS
students marks final years high school first years university.,students marks;final years high school;first years university
dataset about marks of students in their final years at high school and first years at university,marks of students;final years at high school;first years at university
dataset which contains marks of students  in their final years at high school and first years at a particular university.,marks of students;final years at high school;first years at a particular university
"marks of students in their final years at high school and first years at a particular university,schools ",marks of students;final years at high school;first years at a particular university
dataset with marks of students in their final years at high school and first years at a particular university,marks of students;final years at high school;first years at a particular university
high school students final year and first year at university datasets,high school students;final year;first year at university
dataset which contains marks of students in their final years at high school and first years at a particular university,marks of students;final years at high school;first years at a particular university
dataset preferably connected with sales/inventory specific to learn/tryout Power BI & SSRS,sales/inventory;learn/tryout Power BI & SSRS
"marks of students of different schools and boards, final years at high school,  first years at a particular university",marks of students;final years at high school;first years at a particular university
datasets of students marks in their high school final years,students marks;high school final years
UK Life Sciences companies,UK;Life Sciences companies
"Provide number of related companies, turnover and employment within pharmaceutical, medical, technology, medical biotechnology and industrial biotechnology.",number;companies;turnover;employment;pharmaceutical;medical;technology;medical biotechnology;industrial biotechnology
Turnover rate within pharmaceutical and medical technology industry,Turnover rate;pharmaceutical;medical technology industry
UK Life Sciences company data,UK;Life Sciences company
UK Life Sciences company data number of related companies,UK;Life Sciences company;number;companies
"UK Life Sciences companies in pharmatceutical, medical, technology, and biotechnology industries",UK;Life Sciences companies;pharmatceutical;medical;technology;biotechnology industries
uk life sciences data related companies turnover employment by industry,uk;life sciences;companies;turnover;employment;industry
UK life science company data,UK;life science company
Find tables from 1980-1992 of input output supply,tables;1980;1992;input output supply
input-output supply and use tables starting from the year 1980 until 1992,tables;1980;1992;input-output supply and use
Input Output Supply and Use Tables from 1980 to 1992,Tables;1980;1992;Input Output Supply and Use
data table 1980 to 1992 Uk input output supply,table;1980;1992;Uk;input output supply
Input Output Supply and Use tables 1980 1992 revised,tables;1980;1992;Input Output Supply and Use
Input Output Supply and Use Tables from 1980-1992 any versions,Tables;1980;1992;Input Output Supply and Use
input output supply and use tables from 1980-1992,tables;1980;1992;input output supply and use
1980 1992 tables for input output supply and use,1980;1992;tables;input output supply and use
List of names of people who have been in NHS management within the past 10 years,List;past 10 years;names;people;NHS management
NHS management people in the last 10 years,last 10 years;NHS management people
NHS managers for past 10 years,past 10 years;NHS managers
Nhs management database 10 years,database;10 years;Nhs management
nhs management names in the past ten years,past ten years;nhs management;names
List all the names of the people who have been in NHS management in the past 10 years?,past 10 years;names of the people;NHS management
NHS managers in the last 10 years,last 10 years;NHS managers
research on issues related to insects at the end of the year,the end of the year;research on issues;insects
Statistics for numbers of users and activities for public sector owned leisure centers.,numbers of users and activities;public sector owned leisure centers
Public leisure centres with usage data and activities,Public leisure centres;usage data;activities
"leisure centre statistics on users, activities and peak times",leisure centre;users;activities;peak times
government owned community centers statistics on users activities time period,government owned community centers;users activities;time period
"Use of public sectors owned leisure, capacity, days and the times using",Use;public sectors owned leisure;capacity;days;times using
Activities and number of users public sector owned leisure centres,Activities;number of users;public sector owned leisure centres
public sector-owned leisure centres and statistics on users and activities,public sector-owned leisure centres;statistics on users;activities
"Which  leisure centres have activities on which days of the week, and what activities are people participating in?",leisure centres;activities;days of the week;activities
public sector owned leisure centre activity statistics per day week month time,per day week month;public sector owned leisure centre;activity
digital Broad Rental Market Areas with geographical boundaries,digital;Broad Rental Market Areas;geographical boundaries
number of people women age with 34 years old ?,34 years old;number;women
what are the ranges  in rent,ranges  in rent
Geographical boundaries for broad rental market areas in digital form,digital form;Geographical boundaries;broad rental market areas
how many woman age from 25 -34 years old are there?,25 -34 years old;woman
Broad Rental Market geographic boundaries,Broad Rental Market;geographic boundaries
